user_input,retrieved_contexts,response,reference,faithfulness,answer_relevancy,context_precision,context_recall,answer_correctness
"Berdasarkan Lampiran 4A, kalimat apa yang tertulis tepat di bawah tulisan 'SKRIPSI' pada halaman judul skripsi S1 Ilmu Komputer?","['Tahun Terbit\n\nTuliskan tahun mahasiswa dinyatakan lulus. 20\n\nPanduan Umum\n\n\n---\n\nContoh halaman judul dapat dilihat pada Lampiran 4A (S1 Ilmu Komputer), Lampiran 4B (S1 Teknologi Informasi), dan Lampiran 4C (Ekstensi S1 Ilmu Komputer). ## 3.5. Persetujuan\n\nPada lembar persetujuan tuliskan informasi berikut: Judul, Kategori, Nama, NIM, Program Studi dan Fakultas. Contoh lembar persetujuan dapat dilihat pada Lampiran 5. ## 3.6. Pernyataan\n\nPada lembar pernyataan dituliskan pernyataan berikut:\n\n> **Saya mengakui bahwa skripsi ini adalah hasil karya saya sendiri, kecuali beberapa kutipan dan ringkasan yang masing-masing telah disebutkan sumbernya.**\n\nContoh lembar pernyataan dapat dilihat pada Lampiran 6. ## 3.7.', 'Satunya tujuan penulisan bab ini adalah untuk memperkenalkan kepada para pembaca tentang apa yang akan dipaparkan dalam skripsi/tesis.""]\n        end\n        \n        subgraph Paragraph2 ["" ""]\n            direction LR\n            M1[""Masuk 6ketukan""] --- Text2[""Pertama-tama jelaskanlah pentingnya penelitian yang dilakukan, yakni apa permasalahan yang dihadapi dan seberapa penting masalah tersebut untuk diselesaikan.""]\n        end\n        \n        subgraph Paragraph3 ["" ""]\n            direction LR\n            S2[""1.5spasi""] --- Text3[""... dst""]\n        end\n        \n        subgraph SubSection ["" ""]\n            direction TB\n            SS1[""*1.1.1. Rumusan Masalah*""]\n            SS2[""Pada sub-subbab Rumusan Masalah dipaparkan dengan jelas dan ringkas tentang permasalahan yang akan diteliti. Biasanya rumusan masalah ditulis dalam satu paragraph dan mengandung satu kalimat tanya tentang bagaimana menyelesaikan masalah yang akan diteliti.""]\n        end\n    end\n    \n    SubSection --> PageNum[""1""]\n    PageNum --> MarginBottom[""25 mm""]\n    MarginBottom --- BottomEdge[Tepi kertas]\n```\n\nTepi kertas\n\nLampiran\n\n63\n\n\n---\n\n# Lampiran 4A\n# Contoh Halaman Judul Skripsi S1 Ilmu Komputer\n\n210 mm\n297 mm\n\n60 mm\n\nJUDUL SKRIPSI UNTUK PROGRAM S1\nILMU KOMPUTER\n\n**SKRIPSI**\n\nDiajukan untuk melengkapi tugas dan memenuhi syarat memperoleh ijazah\nSarjana Ilmu Komputer\n\nNAMA MAHASISWA\nNIM\n\nLogo Universitas Sumatera Utara\n50 mm\n\nPROGRAM STUDI S1 ILMU KOMPUTER\nFAKULTAS ILMU KOMPUTER DAN TEKNOLOGI INFORMASI', 'Cetakan dan Penggandaan\n\n### 1.5.1. Cetakan\n\nNaskah dicetak hanya di sebelah halaman saja (tidak timbal balik). Pada waktu menjilid, halaman yang berisi tulisan berada di sebelah kanan. Bentuk\n\n7\n\n\n---\n\n## *1.5.2. Penggandaan*\n\nGunakanlah *fotocopy* atau cetak ofset yang bermutu baik. Tidak diperkenankan menggandakan tugas akhir manggunakan kertas karbon. 8\n\n*Panduan Umum*\n\n\n---\n\n# BAB 2\n# FORMAT\n\n## 2.1. Margin Awal Bab\n\n<table>\n  <tbody>\n    <tr>\n        <td>Margin atas</td>\n<td>: 50 mm dari tepi atas kertas</td>\n    </tr>\n<tr>\n        <td>Margin kanan</td>\n<td>: 25 mm dari tepi kanan kertas</td>\n    </tr>\n<tr>\n        <td>Margin kiri</td>\n<td>: 38 mm dari tepi kiri kertas</td>\n    </tr>\n<tr>\n        <td>Margin bawah</td>\n<td>: 25 mm dari tepi bawah kertas</td>\n    </tr>\n  </tbody>\n</table>\n\n## 2.2. Margin Keseluruhan Naskah\n\n<table>\n  <tbody>\n    <tr>\n        <td>Margin atas</td>\n<td>: 30 mm dari tepi atas kertas</td>\n    </tr>\n<tr>\n        <td>Margin kanan</td>\n<td>: 25 mm dari tepi kanan kertas</td>\n    </tr>\n<tr>\n        <td>Margin kiri</td>\n<td>: 38 mm dari tepi kiri kertas</td>\n    </tr>\n<tr>\n        <td>Margin bawah</td>\n<td>: 25 mm dari tepi bawah kertas</td>\n    </tr>\n  </tbody>\n</table>\n\n## 2.3. Aturan Penulisan Naskah\n\nPengetikan naskah skripsi hendaklah mematuhi aturan-aturan berikut:\n\n*a)* Sebuah halaman baru hendaklah memuat sekurang-kurangnya dua baris teks ketikan.', 'Kulit Depan\n\n*1.2.1. Margin Atas dan Margin Bawah*\n\nBatas atas dan batas bawah ketikan pada kulit depan masing-masing adalah 60 mm dari tepi kertas. ---\n\n### 1.2.2. *Judul*\n\nJudul skripsi ditulis rata tengah. Apabila terdiri dari dua atau lebih baris kalimat, ditulis dengan format piramida terbalik dan jarak antara kalimat pertama dengan kalimat-kalimat berikutnya adalah 1.5 spasi. ### 1.2.3. *Jenis*\n\nKata SKRIPSI ditulis secara proporsional antara kalimat terakhir judul tulisan dan nama mahasiswa. ### 1.2.4. *Nama dan NIM*\n\nNama dan Nomor Induk Mahasiswa (NIM) ditulis dalam dua baris dengan jarak 1.5 spasi. Nama dan NIM ditulis secara proporsional antara kata SKRIPSI dan Logo Fakultas. ### 1.2.5. *Logo*\n\nLogo Fakultas Ilmu Komputer dan Teknologi Informasi diletakkan di tengah-tengah antara tepi atas dan tepi bawah kertas. Ukuran logo adalah (50 x 50) mm. ### 1.2.6. *Terbitan dan tahun terbit*\n\nNama program studi, nama fakultas, nama universitas, kota, dan tahun terbit dituliskan secara proporsional di bawah Logo Fakultas, masing-masing dalam satu baris dan jarak antar baris adalah 1.5 spasi. 4\n\nPanduan Umum\n\n\n---\n\n### 1.2.7. Jenis huruf, ukuran dan warna\n\nSemua tulisan pada kulit depan adalah *Times New Roman* berukuran 14 Point dalam huruf besar (kapital). Untuk program studi Ilmu Komputer tulisan dengan tinta berwarna emas, sedangkan untuk program studi Teknologi Informasi tulisan dengan tinta berwarna hitam. ### 1.2.8. Warna Kulit\n\nProgram Studi S1 ILMU KOMPUTER: Hitam. P', 'Penomoran halaman lampiran melanjutkan nomor halaman sebelumnya. 24\n\nPanduan Umum\n\n\n---\n\n*BAGIAN KEDUA:*\n# RUJUKAN\n\nLogo Fakultas Ilmu Komputer dan Teknologi Informasi\n\n---\n\nNO_CONTENT_HERE\n\n---\n\n# BAB 4\n# DAFTAR PUSTAKA\n\n## 4.1. Cara Penulisan\n\n### 4.1.1. Sistem Pengarang Tahun\n\na) Daftar pustaka ditulis menurut panduan cara penulisan **Sistem Pengarang Tahun.**\n\nb) Judul bahan-bahan bacaan yang diterbitkan (dicetak dan diedarkan), seperti judul buku dan judul jurnal, ditulis dalam cetak miring (*italic*). c) Dalam daftar pustaka, informasi tentang buku, jurnal, prosiding, surat kabar, wawancara dan sebagainya, tidak perlu dikelompokkan dalam satu kelompok atau kategori sendiri. d) Daftar pustaka dapat ditulis dalam satu spasi. e) Naskah yang ditulis oleh dua orang pengarang dipisahkan oleh tanda &. f) Naskah yang ditulis oleh lebih dari dua orang, nama terakhir dipisahkan oleh tanda &. ### 4.1.2. Penulisan nama pengarang\n\nNama pengarang hendaklah ditulis mengikuti aturan nama akhir yang diikuti dengan inisial nama depan dan inisial nama tengah. Nama ditulis secara lengkap sebagaimana yang tertera pada halaman judul karya yang ditulisnya, atau seperti yang\n\n---\n\ntertera pada informasi hak cipta yang memuat data katalog dalam terbitan (*cataloging in publication data*), tanpa pangkat dan gelar. a) Nama pengarang Barat atau pengarang bangsa lain yang menggunakan nama keluarga, hendaklah ditulis dengan nama keluarga saja, selain nama keluarga itu hendaklah dituliskan menggunaka', 'c) Penjelasan atas hasil yang diperoleh. Hal-hal berikut tidak termasuk di dalam abstrak:\n\na) Tambahan, perbaikan, atau informasi lainnya yang tidak terdapat dalam teks skripsi. b) Tabel, gambar, dan kutipan langsung. c) Perincian percobaan, tinjauan pustaka, bahan penelitian, standard, teknik, dan alat yang digunakan dalam penelitian. Lihat format abstrak/abstract pada Lampiran 7.', '40\n\n*Rujukan*\n\n\n---\n\n# BAB 5\n# RUJUKAN DALAM TEKS\n\n## 5.1. Pendahuluan\n\nTujuan penulisan rujukan dalam teks adalah untuk memudahkan penulis dan pembaca yang ingin mengetahui dan/atau memperoleh sumber informasi tentang bahan bacaan yang dirujuk dan telah dituliskan dalam Daftar Pustaka. Pada waktu melakukan rujukan, hendaklah dihindarkan menyitir/mengutip keseluruhan teks sumber (*copy-paste*). Untuk mengutip sebuah sumber, pertama-tama lakukanlah penyebutan kembali (*re-statement*) kalimat-kalimat sumber dengan menggunakan bentuk lain atau kata-kata lain yang memiliki makna yang sama (*paraphrase*). Kemudian tuliskanlah sumber rujukan kalimat-kalimat yang dikutip tersebut.', '### 3.1.3. Bagian belakang\n\nBagian belakang skripsi biasanya hanya terdiri dari dua bagian, yaitu daftar pustaka dan lampiran. Kedua bagian ini hendaklah menggunakan penomoran angka Arab yang berlanjut dari bagian tubuh sebelumnya. ## 3.2. Urutan\n\nUrutan lengkap susunan dan kandungan skripsi adalah sebagai berikut:\n\n18\n\nPanduan Umum\n\n\n---\n\nKULIT DALAM\n\nHALAMAN JUDUL\n\nPERSETUJUAN\n\nPERNYATAAN ORISINALITAS\n\nUCAPAN TERIMA KASIH\n\nABSTRAK\n\nABSTRACT\n\nDAFTAR ISI\n\nDAFTAR TABEL (Jika perlu)\n\nDAFTAR GAMBAR (Jika perlu)\n\nDAFTAR ISTILAH (Jika Perlu)\n\nTEKS UTAMA\n\nDAFTAR PUSTAKA\n\nLAMPIRAN\n\n## 3.3. Kulit Dalam\n\nKulit dalam adalah salinan dari kulit luar dengan format yang sama. ## 3.4.', '68\n\nLampiran\n\n\n---\n\n# Lampiran 7\n# Contoh Abstrak\n\nTepi kertas\n$$ \\downarrow $$\n30 mm\n**ABSTRAK**\n} 3 x 1.5 Spasi\n\nAbstrak dan terjemahannya dalam bahasa Inggeris ditulis masing-masing di halaman baru setelah lembar ucapan terima kasih. Judul ABSTRAK atau ABSTRACT ditulis ditengah-tengah halaman, 30 mm dari batas atas kertas. Teks abstrak hanya ditulis dalam satu paragraf saja, 38 mm dari batas kiri kertas dan 25 mm dari batas kanan kertas. Panjang abstrak antara 200 hingga 300 kata. $$ \\leftarrow $$ 38 mm\n25 mm $$ \\rightarrow $$\n\nTepi kertas\n\nLampiran\n\n69\n\n\n---\n\n# Lampiran 8\n# Abstract\n\n```mermaid\ngraph TD\n    A[Tepi kertas] --- B[30 mm]\n    B --- C[TITLE IN ENGLISH]\n    C --- D[ABSTRACT]\n    D --- E[""} 3 x 1.5 Spasi""]\n    E --- F[""Abstract is the English translation of the Indonesian version ofthe *abstrak*. Abstract is written in a new page after theacknowledgement page.', 'Hal ini dirasa penting karena skripsi adalah sebuah karya ilmiah yang harus memenuhi kriteria yang berlaku. Tim penyusun mengucapkan terima kasih atas berbagai pihak yang telah membantu hingga selesainya buku ini. Kami sangat mengharapkan kritik dan saran dari para pembaca untuk kesempurnaan buku ini. Medan, Oktober 2012\n\nTim Penyusun\n\n---\n\nNO_CONTENT_HERE\n\n---\n\n# Daftar Isi\n\n<table>\n  <thead>\n    <tr>\n        <th> </th>\n        <th> </th>\n        <th>Hal.</th>\n    </tr>\n  </thead>\n  <tbody>\n    <tr>\n        <td colspan=""2"">Kata Pengantar</td>\n<td>iii</td>\n    </tr>\n<tr>\n        <td colspan=""2"">Daftar Isi</td>\n<td>v</td>\n    </tr>\n<tr>\n        <td colspan=""3""><strong>BAGIAN PERTAMA: PANDUAN UMUM</strong></td>\n    </tr>\n<tr>\n        <td><strong>Bab 1</strong></td>\n<td><strong>Bentuk</strong></td>\n<td>3</td>\n    </tr>\n<tr>\n        <td> </td>\n<td>1.1.']","Berdasarkan Lampiran 4A, kalimat yang tertulis tepat di bawah tulisan 'SKRIPSI' pada halaman judul skripsi S1 Ilmu Komputer adalah:

""Diajukan untuk melengkapi tugas dan memenuhi syarat memperoleh ijazah Sarjana Ilmu Komputer""

Tulisan ini berada di bawah judul 'SKRIPSI' dan merupakan bagian dari halaman judul skripsi S1 Ilmu Komputer.",Kalimat di bawah 'SKRIPSI': Diajukan untuk melengkapi tugas dan memenuhi syarat memperoleh ijazah Sarjana Ilmu Komputer.,0.6666666666666666,0.9434369357914333,0.0,1.0,0.6437297252374824
Berapa spasi yang digunakan untuk penulisan sub-bab '1.1. Latar Belakang' menurut Lampiran 3?,"['### 1.4.2. Selang Baris (Spasi)\n\nKeseluruhan naskah ditulis dalam 1.5 spasi. Penulisan 1 spasi hanya diperbolehkan untuk penulisan entri tabel, daftar pustaka, dan daftar-daftar lainnya yang diperlukan. ### 1.4.3. Penomoran dan judul bab\n\nSemua bab diberi nomor menggunakan angka Arab: Bab 1, Bab 2, Bab 3, dst. diketik rata tengah. Judul bab diketik rata tengah dengan HURUF BESAR TEBAL di tengah-tengah antara batas (*margin*) kiri dan kanan. ### 1.4.4. Penomoran dan judul sub-bab level 1\n\nPenomoran sub-bab level 1 ditulis cetak tebal di pinggir kiri batas (*margin*) sesuai dengan nomor bab. Judul sub-bab ditulis cetak tebal dengan huruf besar di setiap kata. 6\n\nPanduan Umum\n\n\n---\n\nContoh:\n\n## 1.2. Rumusan Masalah\n\n### 1.4.5. Penomoran dan judul sub-bab level 2\n\nIni adalah level maksimum dalam sistem penomoran yang dianjurkan di dalam skripsi. Nomor dan judul sub-bab ditulis cetak miring dengan format huruf kalimat, yaitu huruf besar hanya pada awal kalimat. Contoh:\n\n### 1.3.1. Algoritma dan struktur data yang digunakan\n\n### 1.4.6. Paragraf\n\nParagraf pertama pada setiap bab, sub-bab level 1 dan sub-bab level 2 ditulis rata kiri dan rata kanan. Paragraf berikutnya ditulis masuk dengan ukuran *tab* 6 (karakter). ### 1.4.7. Contoh\n\nContoh format untuk memulai penulisan bab, sub-bab level 1, dan sub-bab level 2 dapat dilihat pada Lampiran 3. ## 1.5.', 'Satunya tujuan penulisan bab ini adalah untuk memperkenalkan kepada para pembaca tentang apa yang akan dipaparkan dalam skripsi/tesis.""]\n        end\n        \n        subgraph Paragraph2 ["" ""]\n            direction LR\n            M1[""Masuk 6ketukan""] --- Text2[""Pertama-tama jelaskanlah pentingnya penelitian yang dilakukan, yakni apa permasalahan yang dihadapi dan seberapa penting masalah tersebut untuk diselesaikan.""]\n        end\n        \n        subgraph Paragraph3 ["" ""]\n            direction LR\n            S2[""1.5spasi""] --- Text3[""... dst""]\n        end\n        \n        subgraph SubSection ["" ""]\n            direction TB\n            SS1[""*1.1.1. Rumusan Masalah*""]\n            SS2[""Pada sub-subbab Rumusan Masalah dipaparkan dengan jelas dan ringkas tentang permasalahan yang akan diteliti. Biasanya rumusan masalah ditulis dalam satu paragraph dan mengandung satu kalimat tanya tentang bagaimana menyelesaikan masalah yang akan diteliti.""]\n        end\n    end\n    \n    SubSection --> PageNum[""1""]\n    PageNum --> MarginBottom[""25 mm""]\n    MarginBottom --- BottomEdge[Tepi kertas]\n```\n\nTepi kertas\n\nLampiran\n\n63\n\n\n---\n\n# Lampiran 4A\n# Contoh Halaman Judul Skripsi S1 Ilmu Komputer\n\n210 mm\n297 mm\n\n60 mm\n\nJUDUL SKRIPSI UNTUK PROGRAM S1\nILMU KOMPUTER\n\n**SKRIPSI**\n\nDiajukan untuk melengkapi tugas dan memenuhi syarat memperoleh ijazah\nSarjana Ilmu Komputer\n\nNAMA MAHASISWA\nNIM\n\nLogo Universitas Sumatera Utara\n50 mm\n\nPROGRAM STUDI S1 ILMU KOMPUTER\nFAKULTAS ILMU KOMPUTER DAN TEKNOLOGI INFORMASI', 'Ukuran*\n\nA4 (210 mm x 297 mm). Pemotongan kertas untuk tujuan penjilidan jangan melebihi 2mm. *1.1.2. Jenis*\n\nUntuk salinan naskah asli, gunakan kertas HVS dengan berat 70 mg. Untuk salinan naskah berikutnya, dapat digunakan kertas *fotocopy* atau ofset dengan ukuran dan berat yang sama seperti naskah asli serta bermutu baik. *1.1.3.', 'Penomoran halaman lampiran melanjutkan nomor halaman sebelumnya. 24\n\nPanduan Umum\n\n\n---\n\n*BAGIAN KEDUA:*\n# RUJUKAN\n\nLogo Fakultas Ilmu Komputer dan Teknologi Informasi\n\n---\n\nNO_CONTENT_HERE\n\n---\n\n# BAB 4\n# DAFTAR PUSTAKA\n\n## 4.1. Cara Penulisan\n\n### 4.1.1. Sistem Pengarang Tahun\n\na) Daftar pustaka ditulis menurut panduan cara penulisan **Sistem Pengarang Tahun.**\n\nb) Judul bahan-bahan bacaan yang diterbitkan (dicetak dan diedarkan), seperti judul buku dan judul jurnal, ditulis dalam cetak miring (*italic*). c) Dalam daftar pustaka, informasi tentang buku, jurnal, prosiding, surat kabar, wawancara dan sebagainya, tidak perlu dikelompokkan dalam satu kelompok atau kategori sendiri. d) Daftar pustaka dapat ditulis dalam satu spasi. e) Naskah yang ditulis oleh dua orang pengarang dipisahkan oleh tanda &. f) Naskah yang ditulis oleh lebih dari dua orang, nama terakhir dipisahkan oleh tanda &. ### 4.1.2. Penulisan nama pengarang\n\nNama pengarang hendaklah ditulis mengikuti aturan nama akhir yang diikuti dengan inisial nama depan dan inisial nama tengah. Nama ditulis secara lengkap sebagaimana yang tertera pada halaman judul karya yang ditulisnya, atau seperti yang\n\n---\n\ntertera pada informasi hak cipta yang memuat data katalog dalam terbitan (*cataloging in publication data*), tanpa pangkat dan gelar. a) Nama pengarang Barat atau pengarang bangsa lain yang menggunakan nama keluarga, hendaklah ditulis dengan nama keluarga saja, selain nama keluarga itu hendaklah dituliskan menggunaka', 'Cetakan dan Penggandaan\n\n### 1.5.1. Cetakan\n\nNaskah dicetak hanya di sebelah halaman saja (tidak timbal balik). Pada waktu menjilid, halaman yang berisi tulisan berada di sebelah kanan. Bentuk\n\n7\n\n\n---\n\n## *1.5.2. Penggandaan*\n\nGunakanlah *fotocopy* atau cetak ofset yang bermutu baik. Tidak diperkenankan menggandakan tugas akhir manggunakan kertas karbon. 8\n\n*Panduan Umum*\n\n\n---\n\n# BAB 2\n# FORMAT\n\n## 2.1. Margin Awal Bab\n\n<table>\n  <tbody>\n    <tr>\n        <td>Margin atas</td>\n<td>: 50 mm dari tepi atas kertas</td>\n    </tr>\n<tr>\n        <td>Margin kanan</td>\n<td>: 25 mm dari tepi kanan kertas</td>\n    </tr>\n<tr>\n        <td>Margin kiri</td>\n<td>: 38 mm dari tepi kiri kertas</td>\n    </tr>\n<tr>\n        <td>Margin bawah</td>\n<td>: 25 mm dari tepi bawah kertas</td>\n    </tr>\n  </tbody>\n</table>\n\n## 2.2. Margin Keseluruhan Naskah\n\n<table>\n  <tbody>\n    <tr>\n        <td>Margin atas</td>\n<td>: 30 mm dari tepi atas kertas</td>\n    </tr>\n<tr>\n        <td>Margin kanan</td>\n<td>: 25 mm dari tepi kanan kertas</td>\n    </tr>\n<tr>\n        <td>Margin kiri</td>\n<td>: 38 mm dari tepi kiri kertas</td>\n    </tr>\n<tr>\n        <td>Margin bawah</td>\n<td>: 25 mm dari tepi bawah kertas</td>\n    </tr>\n  </tbody>\n</table>\n\n## 2.3. Aturan Penulisan Naskah\n\nPengetikan naskah skripsi hendaklah mematuhi aturan-aturan berikut:\n\n*a)* Sebuah halaman baru hendaklah memuat sekurang-kurangnya dua baris teks ketikan.', '## 3.9. Abstract\n\nPada halaman Abstract tuliskan terjemahan judul skripsi dan terjemahan teks Abstrak dalam bahasa Inggeris. Contoh halaman Abstract dapat dilihat pada Lampiran 8. 22\n\nPanduan Umum\n\n\n---\n\n## 3.10. Daftar Isi\n\nDaftar isi ditulis di halaman baru dengan judul DAFTAR ISI, ditulis di tengah-tengah, 30 mm dari batas atas kertas. Penulisan terdiri dari judul bab, judul sub-bab tingkat pertama, dan judul sub-bab tingkat kedua. ## 3.11. Daftar Tabel, Daftar Gambar dan Daftar Istilah\n\nDaftar tabel, daftar gambar dan daftar istilah masing-masing dapat diberikan pada halaman terpisah apabila diperlukan. Format penulisan adalah dengan menuliskan judul daftar berkenaan di tengah-tengah halaman, 30 mm dari batas atas kertas. Masing-masing isi daftar kemudian dituliskan 38 mm dari batas kiri dan 25 mm dari batas kanan kertas. Contoh format daftar tabel/daftar gambar/daftar istilah dapat dilihat pada Lampiran 9. ## 3.12. Daftar Pustaka\n\nDaftar Pustaka ditulis setelah bab terakhir tugas akhir. Penomoran halaman dilakukan dengan melanjutkan nomor halaman sebelumnya. Masing-masing entri bahan bacaan ditulis satu spasi dengan format *hanging indent*. Contoh format daftar pustaka dapat dilihat pada Lampiran 10. Sistematika Skripsi\n\n23\n\n\n---\n\n## 3.13. Lampiran\n\nLampiran dituliskan setelah daftar pustaka.', '### 3.1.3. Bagian belakang\n\nBagian belakang skripsi biasanya hanya terdiri dari dua bagian, yaitu daftar pustaka dan lampiran. Kedua bagian ini hendaklah menggunakan penomoran angka Arab yang berlanjut dari bagian tubuh sebelumnya. ## 3.2. Urutan\n\nUrutan lengkap susunan dan kandungan skripsi adalah sebagai berikut:\n\n18\n\nPanduan Umum\n\n\n---\n\nKULIT DALAM\n\nHALAMAN JUDUL\n\nPERSETUJUAN\n\nPERNYATAAN ORISINALITAS\n\nUCAPAN TERIMA KASIH\n\nABSTRAK\n\nABSTRACT\n\nDAFTAR ISI\n\nDAFTAR TABEL (Jika perlu)\n\nDAFTAR GAMBAR (Jika perlu)\n\nDAFTAR ISTILAH (Jika Perlu)\n\nTEKS UTAMA\n\nDAFTAR PUSTAKA\n\nLAMPIRAN\n\n## 3.3. Kulit Dalam\n\nKulit dalam adalah salinan dari kulit luar dengan format yang sama. ## 3.4.', 'Kulit Depan\n\n*1.2.1. Margin Atas dan Margin Bawah*\n\nBatas atas dan batas bawah ketikan pada kulit depan masing-masing adalah 60 mm dari tepi kertas. ---\n\n### 1.2.2. *Judul*\n\nJudul skripsi ditulis rata tengah. Apabila terdiri dari dua atau lebih baris kalimat, ditulis dengan format piramida terbalik dan jarak antara kalimat pertama dengan kalimat-kalimat berikutnya adalah 1.5 spasi. ### 1.2.3. *Jenis*\n\nKata SKRIPSI ditulis secara proporsional antara kalimat terakhir judul tulisan dan nama mahasiswa. ### 1.2.4. *Nama dan NIM*\n\nNama dan Nomor Induk Mahasiswa (NIM) ditulis dalam dua baris dengan jarak 1.5 spasi. Nama dan NIM ditulis secara proporsional antara kata SKRIPSI dan Logo Fakultas. ### 1.2.5. *Logo*\n\nLogo Fakultas Ilmu Komputer dan Teknologi Informasi diletakkan di tengah-tengah antara tepi atas dan tepi bawah kertas. Ukuran logo adalah (50 x 50) mm. ### 1.2.6. *Terbitan dan tahun terbit*\n\nNama program studi, nama fakultas, nama universitas, kota, dan tahun terbit dituliskan secara proporsional di bawah Logo Fakultas, masing-masing dalam satu baris dan jarak antar baris adalah 1.5 spasi. 4\n\nPanduan Umum\n\n\n---\n\n### 1.2.7. Jenis huruf, ukuran dan warna\n\nSemua tulisan pada kulit depan adalah *Times New Roman* berukuran 14 Point dalam huruf besar (kapital). Untuk program studi Ilmu Komputer tulisan dengan tinta berwarna emas, sedangkan untuk program studi Teknologi Informasi tulisan dengan tinta berwarna hitam. ### 1.2.8. Warna Kulit\n\nProgram Studi S1 ILMU KOMPUTER: Hitam. P', '# 4.5. Tata Cara Penulisan Makalah dalam Prosiding\n\nBerikan informasi selengkap mungkin sebagai berikut:\n\n*Daftar Pustaka*\n\n35\n\n\n---\n\n<u>Nama pengarang</u>, titik\n\n<u>Tahun</u>, titik\n\n<u>Judul makalah</u>, titik\n\n<u>Nama prosiding</u> (*italic*), koma\n\n<u>Halaman</u> lengkap makalah, titik\n\n## 4.5.1. Pengarang tunggal\n\nOkwonu, F.Z.', 'Tingkat kesulitan skripsi sesuai untuk kelayakan skripsi. 3.']","Menurut Lampiran 3, penulisan sub-bab '1.1. Latar Belakang' menggunakan 1.5 spasi.",Sub-bab '1.1. Latar Belakang' ditulis dengan jarak 4 spasi.,0.5,0.8836704586923544,0.7708333333140625,0.0,0.509437234432862
