user_input,retrieved_contexts,response,reference,faithfulness,answer_relevancy,context_precision,context_recall,answer_correctness
"Berapa ukuran, jenis, dan warna kertas yang diwajibkan untuk salinan naskah asli skripsi?","['Ukuran*\n\nA4 (210 mm x 297 mm). Pemotongan kertas untuk tujuan penjilidan jangan melebihi 2mm. *1.1.2. Jenis*\n\nUntuk salinan naskah asli, gunakan kertas HVS dengan berat 70 mg. Untuk salinan naskah berikutnya, dapat digunakan kertas *fotocopy* atau ofset dengan ukuran dan berat yang sama seperti naskah asli serta bermutu baik. *1.1.3.', 'Cetakan dan Penggandaan\n\n### 1.5.1. Cetakan\n\nNaskah dicetak hanya di sebelah halaman saja (tidak timbal balik). Pada waktu menjilid, halaman yang berisi tulisan berada di sebelah kanan. Bentuk\n\n7\n\n\n---\n\n## *1.5.2. Penggandaan*\n\nGunakanlah *fotocopy* atau cetak ofset yang bermutu baik. Tidak diperkenankan menggandakan tugas akhir manggunakan kertas karbon. 8\n\n*Panduan Umum*\n\n\n---\n\n# BAB 2\n# FORMAT\n\n## 2.1. Margin Awal Bab\n\n<table>\n  <tbody>\n    <tr>\n        <td>Margin atas</td>\n<td>: 50 mm dari tepi atas kertas</td>\n    </tr>\n<tr>\n        <td>Margin kanan</td>\n<td>: 25 mm dari tepi kanan kertas</td>\n    </tr>\n<tr>\n        <td>Margin kiri</td>\n<td>: 38 mm dari tepi kiri kertas</td>\n    </tr>\n<tr>\n        <td>Margin bawah</td>\n<td>: 25 mm dari tepi bawah kertas</td>\n    </tr>\n  </tbody>\n</table>\n\n## 2.2. Margin Keseluruhan Naskah\n\n<table>\n  <tbody>\n    <tr>\n        <td>Margin atas</td>\n<td>: 30 mm dari tepi atas kertas</td>\n    </tr>\n<tr>\n        <td>Margin kanan</td>\n<td>: 25 mm dari tepi kanan kertas</td>\n    </tr>\n<tr>\n        <td>Margin kiri</td>\n<td>: 38 mm dari tepi kiri kertas</td>\n    </tr>\n<tr>\n        <td>Margin bawah</td>\n<td>: 25 mm dari tepi bawah kertas</td>\n    </tr>\n  </tbody>\n</table>\n\n## 2.3. Aturan Penulisan Naskah\n\nPengetikan naskah skripsi hendaklah mematuhi aturan-aturan berikut:\n\n*a)* Sebuah halaman baru hendaklah memuat sekurang-kurangnya dua baris teks ketikan.', 'Kulit Depan\n\n*1.2.1. Margin Atas dan Margin Bawah*\n\nBatas atas dan batas bawah ketikan pada kulit depan masing-masing adalah 60 mm dari tepi kertas. ---\n\n### 1.2.2. *Judul*\n\nJudul skripsi ditulis rata tengah. Apabila terdiri dari dua atau lebih baris kalimat, ditulis dengan format piramida terbalik dan jarak antara kalimat pertama dengan kalimat-kalimat berikutnya adalah 1.5 spasi. ### 1.2.3. *Jenis*\n\nKata SKRIPSI ditulis secara proporsional antara kalimat terakhir judul tulisan dan nama mahasiswa. ### 1.2.4. *Nama dan NIM*\n\nNama dan Nomor Induk Mahasiswa (NIM) ditulis dalam dua baris dengan jarak 1.5 spasi. Nama dan NIM ditulis secara proporsional antara kata SKRIPSI dan Logo Fakultas. ### 1.2.5. *Logo*\n\nLogo Fakultas Ilmu Komputer dan Teknologi Informasi diletakkan di tengah-tengah antara tepi atas dan tepi bawah kertas. Ukuran logo adalah (50 x 50) mm. ### 1.2.6. *Terbitan dan tahun terbit*\n\nNama program studi, nama fakultas, nama universitas, kota, dan tahun terbit dituliskan secara proporsional di bawah Logo Fakultas, masing-masing dalam satu baris dan jarak antar baris adalah 1.5 spasi. 4\n\nPanduan Umum\n\n\n---\n\n### 1.2.7. Jenis huruf, ukuran dan warna\n\nSemua tulisan pada kulit depan adalah *Times New Roman* berukuran 14 Point dalam huruf besar (kapital). Untuk program studi Ilmu Komputer tulisan dengan tinta berwarna emas, sedangkan untuk program studi Teknologi Informasi tulisan dengan tinta berwarna hitam. ### 1.2.8. Warna Kulit\n\nProgram Studi S1 ILMU KOMPUTER: Hitam. P', 'Penomoran Halaman\n\n### 2.4.1. *Jenis huruf*\n\nNomor halaman menggunakan jenis huruf yang sama seperti teks naskah, yaitu *Times New Roman* 12 point. ### 2.4.2. *Jenis nomor*\n\nPemberian nomor halaman permulaan dimulai dari halaman judul dengan membubuhkan angka Romawi kecil secara berturut-turut, dimulai dengan i, ii, iii, ... hingga lembar terakhir halaman daftar-daftar, sebelum dimulainya bab 1. Pemberian nomor halaman teks dimulai dari bab 1 adalah menggunakan angka Arab 1, 2, 3, ... 10\n\nPenduan Umum\n\n\n---\n\n### 2.4.3. Nomor halaman pada halaman judul\n\nHalaman permulaan (halaman judul) yang seharusnya diberi nomor halaman “i”, nomor halamannya tidak dituliskan. ### 2.4.4. Nomor halaman selain halaman judul\n\nNomor halaman permulaan setelah halaman judul ditulis di sudut kanan atas, 15 mm dari tepi atas kertas dan digit terakhir nomor halaman berjarak 25 mm dari tepi kanan kertas. ### 2.4.5. Nomor halaman pada judul bab\n\nHalaman pertama teks di setiap permulaan Bab yang seharusnya diberi nomor, misalnya “1” untuk Bab 1, nomor halamannya tidak dituliskan. ### 2.4.6. Letak nomor halaman pada bukan judul bab\n\nNomor halaman pada halaman-halaman yang bukan judul bab dituliskan di sudut kanan atas, 15 mm dari tepi atas kertas dan digit terakhir nomor halaman berjarak 25 mm dari tepi kanan kertas. ## 2.5.', 'Universiti Kebangsaan Malaysia. Daftar Pustaka\n\n39\n\n\n---\n\n# 4.9. Bahan Rujukan Elektronik\n\nRujukan untuk bahan bacaan yang diterbitkan secara elektronik, seperti halaman web, jurnal elektronik, database elektronik dan e-book haruslah mengandung informasi berikut:\n\n<u>Nama pengarang</u>, titik\n\n<u>Tahun</u>, titik\n\n<u>Judul tulisan</u>, titik\n\n<u>Nama jurnal/prosiding/buku</u>, titik\n\n<u>Nomor jilid</u>, (tebal)\n\n<u>Nomor isu</u>, (dalam tanda kurung)\n\n<u>Halaman seluruh tulisan</u>, titik\n\n<u>Jenis media</u>, (dalam tanda kurung)\n\n<u>Alamat web</u> (*hyperlink*)\n\n<u>Tanggal akses</u>, (dalam tanda kurung) titik\n\nApabila perlu informasi di atas dapat disesuaikan dengan tidak mengganggu keabsahan sumber bahan yang dirujuk. Contoh:\n\nSitompul, O.S.', '4) Sampel kuesioner yang telah berisi. Dalam hal ini peneliti telah menjabarkan dalam teks utama tentang bagaimana kuesioner terebut dikonstruksikan dan dikelola, dan meringkaskan hasil yang diperoleh. 5) *Source program* yang dibangun sebagai hasil implementasi sistem yang dikemukakan. 54\n\n*Panduan Khusus*\n\n\n---\n\n### DAFTAR BACAAN\n\nEvans, D.', 'Hal ini dirasa penting karena skripsi adalah sebuah karya ilmiah yang harus memenuhi kriteria yang berlaku. Tim penyusun mengucapkan terima kasih atas berbagai pihak yang telah membantu hingga selesainya buku ini. Kami sangat mengharapkan kritik dan saran dari para pembaca untuk kesempurnaan buku ini. Medan, Oktober 2012\n\nTim Penyusun\n\n---\n\nNO_CONTENT_HERE\n\n---\n\n# Daftar Isi\n\n<table>\n  <thead>\n    <tr>\n        <th> </th>\n        <th> </th>\n        <th>Hal.</th>\n    </tr>\n  </thead>\n  <tbody>\n    <tr>\n        <td colspan=""2"">Kata Pengantar</td>\n<td>iii</td>\n    </tr>\n<tr>\n        <td colspan=""2"">Daftar Isi</td>\n<td>v</td>\n    </tr>\n<tr>\n        <td colspan=""3""><strong>BAGIAN PERTAMA: PANDUAN UMUM</strong></td>\n    </tr>\n<tr>\n        <td><strong>Bab 1</strong></td>\n<td><strong>Bentuk</strong></td>\n<td>3</td>\n    </tr>\n<tr>\n        <td> </td>\n<td>1.1.', 'Halaman Judul\n\nHalaman judul memuat informasi tentang skripsi, terdiri dari:\n\nA. Judul Skripsi\n\nApabila judul skripsi mengandung lebih dari satu baris teks, tulislah baris-baris judul tersebut dalam format piramida terbalik. Sistematika Skripsi\n\n19\n\n\n---\n\nB. Jenis Tulisan\n\nJenis tulisan ditulis: SKRIPSI. C. Tujuan Skripsi Diajukan\n\n*Untuk Skripsi Ilmu Komputer:*\n\nDiajukan untuk melengkapi tugas dan memenuhi syarat memperoleh ijazah Sarjana Ilmu Komputer\n\n*Untuk Skripsi Teknologi Informasi:*\n\nDiajukan untuk melengkapi tugas dan memenuhi syarat memperoleh ijazah Sarjana Teknologi Informasi\n\nD. Nama Mahasiswa\n\nTulis nama lengkap mahasiswa\n\nE.', '40\n\n*Rujukan*\n\n\n---\n\n# BAB 5\n# RUJUKAN DALAM TEKS\n\n## 5.1. Pendahuluan\n\nTujuan penulisan rujukan dalam teks adalah untuk memudahkan penulis dan pembaca yang ingin mengetahui dan/atau memperoleh sumber informasi tentang bahan bacaan yang dirujuk dan telah dituliskan dalam Daftar Pustaka. Pada waktu melakukan rujukan, hendaklah dihindarkan menyitir/mengutip keseluruhan teks sumber (*copy-paste*). Untuk mengutip sebuah sumber, pertama-tama lakukanlah penyebutan kembali (*re-statement*) kalimat-kalimat sumber dengan menggunakan bentuk lain atau kata-kata lain yang memiliki makna yang sama (*paraphrase*). Kemudian tuliskanlah sumber rujukan kalimat-kalimat yang dikutip tersebut.', 'Sistematika Skripsi\n\n21\n\n\n---\n\n## 3.8. Abstrak\n\nAbstrak dan terjemahannya dalam bahasa Inggeris ditulis masing-masing di halaman baru setelah lembar ucapan terima kasih. Judul ABSTRAK dan ABSTRACT ditulis d itengah-tengah halaman, 30 mm dari batas atas kertas. Teks abstrak hanya ditulis dalam satu paragraf saja, 38 mm dari batas kiri kertas dan 25 mm dari batas kanan kertas. Panjang abstrak antara 200 hingga 300 kata dan berisi informasi antara lain:\n\na) Tujuan penelitian. b) Metodologi yang digunakan berupa algoritma, teknik, dan kegunaannya.']","Berikut adalah jawaban atas pertanyaan Anda:

Ukuran kertas yang diwajibkan untuk salinan naskah asli skripsi adalah A4 (210 mm x 297 mm). Pemotongan kertas untuk tujuan penjilidan tidak boleh melebihi 2mm.

Jenis kertas yang diwajibkan untuk salinan naskah asli skripsi adalah kertas HVS dengan berat 70 mg.

Warna kertas yang diwajibkan untuk salinan naskah asli skripsi tidak disebutkan secara spesifik dalam sumber yang disediakan. Namun, berdasarkan informasi yang tersedia, dapat disimpulkan bahwa kertas yang digunakan harus memiliki mutu baik dan sesuai dengan standar yang ditetapkan.

Selain itu, perlu diingat bahwa untuk salinan naskah berikutnya, dapat digunakan kertas fotocopy atau ofset dengan ukuran dan berat yang sama seperti naskah asli serta bermutu baik.","Ukuran kertas A4 (210 mm x 297 mm), jenis HVS 70 gram, dan warna kertas putih.",0.6,,0.8819444444297454,1.0,0.47638514024177075
Apa perbedaan warna kulit depan skripsi antara Program Studi S1 Ilmu Komputer dan Program Studi S1 Teknologi Informasi?,"['Kulit Depan\n\n*1.2.1. Margin Atas dan Margin Bawah*\n\nBatas atas dan batas bawah ketikan pada kulit depan masing-masing adalah 60 mm dari tepi kertas. ---\n\n### 1.2.2. *Judul*\n\nJudul skripsi ditulis rata tengah. Apabila terdiri dari dua atau lebih baris kalimat, ditulis dengan format piramida terbalik dan jarak antara kalimat pertama dengan kalimat-kalimat berikutnya adalah 1.5 spasi. ### 1.2.3. *Jenis*\n\nKata SKRIPSI ditulis secara proporsional antara kalimat terakhir judul tulisan dan nama mahasiswa. ### 1.2.4. *Nama dan NIM*\n\nNama dan Nomor Induk Mahasiswa (NIM) ditulis dalam dua baris dengan jarak 1.5 spasi. Nama dan NIM ditulis secara proporsional antara kata SKRIPSI dan Logo Fakultas. ### 1.2.5. *Logo*\n\nLogo Fakultas Ilmu Komputer dan Teknologi Informasi diletakkan di tengah-tengah antara tepi atas dan tepi bawah kertas. Ukuran logo adalah (50 x 50) mm. ### 1.2.6. *Terbitan dan tahun terbit*\n\nNama program studi, nama fakultas, nama universitas, kota, dan tahun terbit dituliskan secara proporsional di bawah Logo Fakultas, masing-masing dalam satu baris dan jarak antar baris adalah 1.5 spasi. 4\n\nPanduan Umum\n\n\n---\n\n### 1.2.7. Jenis huruf, ukuran dan warna\n\nSemua tulisan pada kulit depan adalah *Times New Roman* berukuran 14 Point dalam huruf besar (kapital). Untuk program studi Ilmu Komputer tulisan dengan tinta berwarna emas, sedangkan untuk program studi Teknologi Informasi tulisan dengan tinta berwarna hitam. ### 1.2.8. Warna Kulit\n\nProgram Studi S1 ILMU KOMPUTER: Hitam. P', 'PENDAHULUAN\n\nProgram Studi Ilmu Komputer senantiasa berupaya dengan sungguh-sungguh dan berkesinambungan dalam usaha pencapaian mutu pendidikan yang optimal. Dengan demikian, Program Studi Ilmu Komputer Fasilkom-TI USU dapat menjadi pusat layanan penelitian, pendidikan, pelatihan, konsultasi, dan jasa dalam bidang Komputer dan Teknologi Informasi, serta berperanan penting untuk meningkatkan kesejahteraan masyarakat. Untuk menjamin tercapainya kualitas yang optimal dari proses pendidikan, monitoring beserta evaluasi tingkat keberhasilannya dapat ditentukan dengan adanya Standar Akademik. Standar akademik ini dijadikan sebagai pedoman dan arah untuk pelaksanaan, pengembangan, serta evaluasi pelaksanaan Tridarma Perguruan Tinggi di Program Studi S-1 Ilmu Komputer Fasilkom-TI USU. ## 2. TAHAPAN TUGAS AKHIR\n\nSebagai salah satu syarat memperoleh gelar Sarjana Ilmu Komputer di Program Studi S1 Ilmu Komputer Fasilkom-TI USU mahasiswa diwajibkan membuat suatu karya ilmiah yang disebut Tugas Akhir/Skripsi. Tugas Akhir/Skripsi merupakan suatu kegiatan penelitian yang dilakukan bersama-sama oleh dosen dan mahasiswa. Dengan mengerjakan Tugas Akhir/Skripsi diharapkan mahasiswa mampu merangkum dan mengaplikasikan semua pengalaman pendidikan untuk memecahkan masalah dalam bidang keahlian/bidang studi tertentu secara sistematis, logis, kreatif, kritis dan berbobot berdasarkan data/informasi yang akurat dan didukung oleh analisis yang tepat dan menuangkannya dalam bentuk penulisan karya ilmiah', 'Telah menyelesaikan semua persyaratan pemberkasan Seminar. Untuk berkas yang perlu dipersiapkan dapat dilihat pada e-learning Tugas Akhir Ilmu Komputer. 5. Telah mendapat persetujuan tim pembimbing terhadap rancangan Skripsi; dan\n6. Telah mendapatkanpenetapan waktu pelaksanaan oleh Program Studi dan Fakultas.', 'Bila dalam proses pembuatan Tugas Akhir/Skripsi ternyata mahasiswa merasa tidak mampu melanjutkan, maka mahasiswa dapat mengajukan surat permohonan pembatalan Tugas Akhir/Skripsi ditujukan kepada Ketua Program Studi S1 Ilmu Komputer dengan sepengetahuan Dosen Pembimbing. 12\n\nProgram Studi Ilmu Komputer Fasilkom-TI USU\n\n\n---\n\n\n\n<table>\n  <thead>\n    <tr>\n        <th rowspan=""5"">Universitas Sumatera Utara logo</th>\n        <th rowspan=""5""><strong>PEDOMAN TUGAS<br/>AKHIR/SKRIPSI</strong></th>\n        <th>No. Dokumen</th>\n        <th>:</th>\n    </tr>\n<tr>\n        <th>Edisi</th>\n        <th>:</th>\n    </tr>\n<tr>\n        <th>Revisi</th>\n        <th>:</th>\n    </tr>\n<tr>\n        <th>Tanggal Terbit</th>\n        <th>: 2022</th>\n    </tr>\n<tr>\n        <th>Halaman</th>\n        <th>: 13 dari 14</th>\n    </tr>\n  </thead>\n</table>\n\n13\n\nProgram Studi Ilmu Komputer Fasilkom-TI USU', '## 3. DOSEN PEMBIMBING\n\n1. Pembimbing Tugas Akhir/Skripsi berfungsi sebagai penasehat dan fasilitator yang mengarahkan perencanaan, pelaksanaan dan pembuatan Tugas Akhir/Skripsi dari mulai penulisan executive summary (Exum) sampai dengan sidang meja hijau mahasiswa. 2. Pembimbing 1 dan 2 ditentukan oleh Prodi berdasarkan rapat sosialisasi dan juga expertise dosen. Kriteria Pembimbing adalah:\n\n* Dosen Tetap Program Studi S1 Ilmu Komputer Fasilkom-TI USU dengan jabatan Akademik minimal Asisten Ahli untuk pembimbing 1. * Dosen/Tenaga Ahli dari luar Program Studi S1 Ilmu Komputer Fasikom-TI USU dengan keahlian sesuai dengan Tugas Akhir/Skripsi yang dikerjakan dan mendapat persetujuan dari Ketua Program Studi S1 Ilmu Komputer Fasilkom-TI USU. 4. Jika Pembimbing 1 bukan Dosen Tetap Program Studi S1 Ilmu Komputer Fasilkom-TI USU, maka pembimbing 2 harus merupakan Dosen Tetap Program Studi S1 Ilmu Komputer Fasilkom-TI USU, begitu juga sebaliknya. 5. Dosen Pembimbing 1 wajib memiliki jabatan minimal Asisten Ahli dengan pendidikan minimal S2. 6. Untuk Dosen dengan jabatan minimal Lektor dapat mengajukan diri sebagai pembimbing 1 maksimal 10 mahasiswa. 7. Untuk Dosen dengan jabatan Asisten Ahli dapat mengajukan diri sebagai pembimbing 1 maksimal 6 mahasiswa. 8. Pengajuan diri sebagai dosen pembimbing dilakukan dengan menawarkan judul/topik Tugas Akhir kepada mahasiswa. 9. Untuk dosen dengan jabatan Tenaga Pengajar dapat menjadi pembimbing 2 yang distribusi pembagian diatur oleh Prodi. 1', '# Prosedur Tugas Akhir Prodi S-1 Ilmu Komputer\n\n*Diperuntukkan Bagi Mahasiswa Program Studi Ilmu Komputer yang sedang mengambil Mata Kuliah Tugas Akhir.*\n\nKepada mahasiswa, mohon dibaca deskripsi dan panduan submisi dengan baik agar tidak terjadi kesalahan. Jadwal Kegiatan Seminar Proposal, Hasil dan Sidang akan diberikan setelah syarat berikut ini terpenuhi :\n\n1. Mulai Semester Genap 2024/2025 Jadwal Tanggal Kegiatan Seminar Proposal, Hasil dan Sidang sesuai dengan jadwal terlampir. 2. Mahasiswa harap memperhatikan dan mengikuti tanggal-tanggal yang tertera pada jadwal. 3.', 'Tahun Terbit\n\nTuliskan tahun mahasiswa dinyatakan lulus. 20\n\nPanduan Umum\n\n\n---\n\nContoh halaman judul dapat dilihat pada Lampiran 4A (S1 Ilmu Komputer), Lampiran 4B (S1 Teknologi Informasi), dan Lampiran 4C (Ekstensi S1 Ilmu Komputer). ## 3.5. Persetujuan\n\nPada lembar persetujuan tuliskan informasi berikut: Judul, Kategori, Nama, NIM, Program Studi dan Fakultas. Contoh lembar persetujuan dapat dilihat pada Lampiran 5. ## 3.6. Pernyataan\n\nPada lembar pernyataan dituliskan pernyataan berikut:\n\n> **Saya mengakui bahwa skripsi ini adalah hasil karya saya sendiri, kecuali beberapa kutipan dan ringkasan yang masing-masing telah disebutkan sumbernya.**\n\nContoh lembar pernyataan dapat dilihat pada Lampiran 6. ## 3.7.', 'Menulis Proposal Penelitian\n\nMahasiswa yang akan menyelesaikan studinya di tingkat sarjana (S1) diwajibkan untuk menuliskan hasil penelitiannya berupa skripsi. Penulisan skripsi tersebut akan dimulai dengan mengajukan proposal penelitian, sebagai kerja awal untuk mengadakan penelitian ilmiah. Proposal penelitian adalah sebuah konsep sementara yang masih harus dikaji dan disempurnakan lebih lanjut melalui seminar proposal. Dalam seminar proposal mahasiswa akan mendapatkan saran-saran perubahan dan penyempurnaan dari peserta seminar untuk menetapkan kelayakan proposal yang diajukan. Apabila proposal yang diajukan disetujui untuk dilanjutkan, mahasiswa kemudian dapat melanjutkan penelitiannya dan dapat berkonsultasi dengan komisi pembimbing yang ditetapkan oleh program studi. Proposal penelitian secara garis besar memuat bagian-bagian sebagai berikut:\n\n1.', 'Pada masa pandemi Covid 19, kegiatan seminar mahasiswa baik itu seminar proposal, seminar hasil dan sidang sarjana dilakukan secara daring dengan platform e-learning USU. Tahapan pemberkasan dan penilaian juga dilakukan melalui e-learning USU, dan setelah USU Kembali melakukan kegiatan perkuliahan secara tatap muka, pemberkasan seminar tetap dilaksanakan melalui e-lerarning agar lebih terdata. Berdasarkan hal ini maka pada pedoman ini juga menjelaskan tahapan pemberkasan yang harus dilakukan oleh mahasiswa dan juga penjelasan tentang penilaian oleh dosen pembimbing dan penguji. Terdapat 2 tahapan utama pada pelaksanaan Tugas Akhir yaitu dari proses pengajuan judul sampai dengan seminar proposal dan dari seminar hasil sampai ke iding meja hijau. 2\n\nProgram Studi Ilmu Komputer Fasilkom-TI USU\n\n\n---\n\n\n\n<table>\n    <tr>\n        <th>UNIVERSITAS SUMATERA UTARA logo</th>\n        <th>**PEDOMAN TUGAS AKHIR/SKRIPSI**</th>\n        <th>No.', 'Penomoran halaman lampiran melanjutkan nomor halaman sebelumnya. 24\n\nPanduan Umum\n\n\n---\n\n*BAGIAN KEDUA:*\n# RUJUKAN\n\nLogo Fakultas Ilmu Komputer dan Teknologi Informasi\n\n---\n\nNO_CONTENT_HERE\n\n---\n\n# BAB 4\n# DAFTAR PUSTAKA\n\n## 4.1. Cara Penulisan\n\n### 4.1.1. Sistem Pengarang Tahun\n\na) Daftar pustaka ditulis menurut panduan cara penulisan **Sistem Pengarang Tahun.**\n\nb) Judul bahan-bahan bacaan yang diterbitkan (dicetak dan diedarkan), seperti judul buku dan judul jurnal, ditulis dalam cetak miring (*italic*). c) Dalam daftar pustaka, informasi tentang buku, jurnal, prosiding, surat kabar, wawancara dan sebagainya, tidak perlu dikelompokkan dalam satu kelompok atau kategori sendiri. d) Daftar pustaka dapat ditulis dalam satu spasi. e) Naskah yang ditulis oleh dua orang pengarang dipisahkan oleh tanda &. f) Naskah yang ditulis oleh lebih dari dua orang, nama terakhir dipisahkan oleh tanda &. ### 4.1.2. Penulisan nama pengarang\n\nNama pengarang hendaklah ditulis mengikuti aturan nama akhir yang diikuti dengan inisial nama depan dan inisial nama tengah. Nama ditulis secara lengkap sebagaimana yang tertera pada halaman judul karya yang ditulisnya, atau seperti yang\n\n---\n\ntertera pada informasi hak cipta yang memuat data katalog dalam terbitan (*cataloging in publication data*), tanpa pangkat dan gelar. a) Nama pengarang Barat atau pengarang bangsa lain yang menggunakan nama keluarga, hendaklah ditulis dengan nama keluarga saja, selain nama keluarga itu hendaklah dituliskan menggunaka']","Berdasarkan Pedoman tulisan tanpa gambar.md, perbedaan warna kulit depan skripsi antara Program Studi S1 Ilmu Komputer dan Program Studi S1 Teknologi Informasi adalah sebagai berikut:

- Program Studi S1 Ilmu Komputer: Hitam
- Program Studi S1 Teknologi Informasi: Tidak disebutkan secara spesifik dalam Pedoman tulisan tanpa gambar.md, namun dapat dilihat pada Pedoman skripsi tambahan.md bahwa untuk program studi Ilmu Komputer tulisan dengan tinta berwarna emas, sedangkan untuk program studi Teknologi Informasi tulisan dengan tinta berwarna hitam.","S1 Ilmu Komputer menggunakan warna kulit Hitam, sedangkan S1 Teknologi Informasi menggunakan warna kulit Abu-abu.",0.5,0.9999999999999999,0.9999999999,0.0,0.4382884561290318
