user_input,retrieved_contexts,response,reference,faithfulness,answer_relevancy,context_precision,context_recall,answer_correctness
Berapa batas minimal dan maksimal jumlah peserta dalam satu kali kegiatan seminar dan sidang?,"['Mahasiswa wajib mengikuti pedoman penulisan skripsi yang telah diupload sebagai panduan penulisan skripsi\n\n4. Jumlah Peserta yang telah mendaftar minimal 1 orang dan maksimal 7 orang dalam satu kali kegiatan seminar dan sidang kecuali ada regulasi khusus lainnya yang berkembang. 5.', 'Pada masa pandemi Covid 19, kegiatan seminar mahasiswa baik itu seminar proposal, seminar hasil dan sidang sarjana dilakukan secara daring dengan platform e-learning USU. Tahapan pemberkasan dan penilaian juga dilakukan melalui e-learning USU, dan setelah USU Kembali melakukan kegiatan perkuliahan secara tatap muka, pemberkasan seminar tetap dilaksanakan melalui e-lerarning agar lebih terdata. Berdasarkan hal ini maka pada pedoman ini juga menjelaskan tahapan pemberkasan yang harus dilakukan oleh mahasiswa dan juga penjelasan tentang penilaian oleh dosen pembimbing dan penguji. Terdapat 2 tahapan utama pada pelaksanaan Tugas Akhir yaitu dari proses pengajuan judul sampai dengan seminar proposal dan dari seminar hasil sampai ke iding meja hijau. 2\n\nProgram Studi Ilmu Komputer Fasilkom-TI USU\n\n\n---\n\n\n\n<table>\n    <tr>\n        <th>UNIVERSITAS SUMATERA UTARA logo</th>\n        <th>**PEDOMAN TUGAS AKHIR/SKRIPSI**</th>\n        <th>No.', 'Urutan Peserta yang dinyatakan terdaftar mengikuti waktu submisi kegiatan Seminar / Sidang ( *First Come First Serve* )\n\n7. Jika kuota pendaftaran belum terpenuhi, maka jadwal tidak akan dibuat.', 'Jadwal bimbingan dilakukan berdasarkan kesepakatan dosen pembimbing dan mahasiswa bimbingan. 15. Dosen pembimbing wajib merespons pertanyaan dari mahasiswa bimbingan maksimal dalam waktu 2 minggu dari waktu submit. 5\n\nProgram Studi Ilmu Komputer Fasilkom-TI USU\n\n\n---\n\n\n\n<table>\n  <thead>\n    <tr>\n        <th rowspan=""5"">Universitas Sumatera Utara logo</th>\n        <th rowspan=""5"">PEDOMAN TUGAS<br/>AKHIR/SKRIPSI</th>\n        <th>No.', '## 3. DOSEN PEMBIMBING\n\n1. Pembimbing Tugas Akhir/Skripsi berfungsi sebagai penasehat dan fasilitator yang mengarahkan perencanaan, pelaksanaan dan pembuatan Tugas Akhir/Skripsi dari mulai penulisan executive summary (Exum) sampai dengan sidang meja hijau mahasiswa. 2. Pembimbing 1 dan 2 ditentukan oleh Prodi berdasarkan rapat sosialisasi dan juga expertise dosen. Kriteria Pembimbing adalah:\n\n* Dosen Tetap Program Studi S1 Ilmu Komputer Fasilkom-TI USU dengan jabatan Akademik minimal Asisten Ahli untuk pembimbing 1. * Dosen/Tenaga Ahli dari luar Program Studi S1 Ilmu Komputer Fasikom-TI USU dengan keahlian sesuai dengan Tugas Akhir/Skripsi yang dikerjakan dan mendapat persetujuan dari Ketua Program Studi S1 Ilmu Komputer Fasilkom-TI USU. 4. Jika Pembimbing 1 bukan Dosen Tetap Program Studi S1 Ilmu Komputer Fasilkom-TI USU, maka pembimbing 2 harus merupakan Dosen Tetap Program Studi S1 Ilmu Komputer Fasilkom-TI USU, begitu juga sebaliknya. 5. Dosen Pembimbing 1 wajib memiliki jabatan minimal Asisten Ahli dengan pendidikan minimal S2. 6. Untuk Dosen dengan jabatan minimal Lektor dapat mengajukan diri sebagai pembimbing 1 maksimal 10 mahasiswa. 7. Untuk Dosen dengan jabatan Asisten Ahli dapat mengajukan diri sebagai pembimbing 1 maksimal 6 mahasiswa. 8. Pengajuan diri sebagai dosen pembimbing dilakukan dengan menawarkan judul/topik Tugas Akhir kepada mahasiswa. 9. Untuk dosen dengan jabatan Tenaga Pengajar dapat menjadi pembimbing 2 yang distribusi pembagian diatur oleh Prodi. 1', 'Kulit Depan\n\n*1.2.1. Margin Atas dan Margin Bawah*\n\nBatas atas dan batas bawah ketikan pada kulit depan masing-masing adalah 60 mm dari tepi kertas. ---\n\n### 1.2.2. *Judul*\n\nJudul skripsi ditulis rata tengah. Apabila terdiri dari dua atau lebih baris kalimat, ditulis dengan format piramida terbalik dan jarak antara kalimat pertama dengan kalimat-kalimat berikutnya adalah 1.5 spasi. ### 1.2.3. *Jenis*\n\nKata SKRIPSI ditulis secara proporsional antara kalimat terakhir judul tulisan dan nama mahasiswa. ### 1.2.4. *Nama dan NIM*\n\nNama dan Nomor Induk Mahasiswa (NIM) ditulis dalam dua baris dengan jarak 1.5 spasi. Nama dan NIM ditulis secara proporsional antara kata SKRIPSI dan Logo Fakultas. ### 1.2.5. *Logo*\n\nLogo Fakultas Ilmu Komputer dan Teknologi Informasi diletakkan di tengah-tengah antara tepi atas dan tepi bawah kertas. Ukuran logo adalah (50 x 50) mm. ### 1.2.6. *Terbitan dan tahun terbit*\n\nNama program studi, nama fakultas, nama universitas, kota, dan tahun terbit dituliskan secara proporsional di bawah Logo Fakultas, masing-masing dalam satu baris dan jarak antar baris adalah 1.5 spasi. 4\n\nPanduan Umum\n\n\n---\n\n### 1.2.7. Jenis huruf, ukuran dan warna\n\nSemua tulisan pada kulit depan adalah *Times New Roman* berukuran 14 Point dalam huruf besar (kapital). Untuk program studi Ilmu Komputer tulisan dengan tinta berwarna emas, sedangkan untuk program studi Teknologi Informasi tulisan dengan tinta berwarna hitam. ### 1.2.8. Warna Kulit\n\nProgram Studi S1 ILMU KOMPUTER: Hitam. P', '# Prosedur Tugas Akhir Prodi S-1 Ilmu Komputer\n\n*Diperuntukkan Bagi Mahasiswa Program Studi Ilmu Komputer yang sedang mengambil Mata Kuliah Tugas Akhir.*\n\nKepada mahasiswa, mohon dibaca deskripsi dan panduan submisi dengan baik agar tidak terjadi kesalahan. Jadwal Kegiatan Seminar Proposal, Hasil dan Sidang akan diberikan setelah syarat berikut ini terpenuhi :\n\n1. Mulai Semester Genap 2024/2025 Jadwal Tanggal Kegiatan Seminar Proposal, Hasil dan Sidang sesuai dengan jadwal terlampir. 2. Mahasiswa harap memperhatikan dan mengikuti tanggal-tanggal yang tertera pada jadwal. 3.', 'Mahasiswa wajib melakukan bimbingan Tugas Akhir/Skripsi sesuai dengan arahan Pembimbing 1 dan/atau Pembimbing 2. Jadwal dan materi konsultasi dicatat dalam Log Book yang disediakan mahasiswa pada saat bimbingan. 3. Bila dalam 1 semester Tugas Akhir/Skripsi tidak selesai dikerjakan, mahasiswa dapat mengajukan permohonan perpanjangan waktu pengerjaan Tugas Akhir/Skripsi maksimal 6 bulan, dan harus memberikan penjelasan dalam sidang pertanggungjawaban Tugas Akhir/Skripsi. 4.', '3. Mahasiswa wajib menyiapkan diri untuk memberikan penjelasan mengenai proposal yang diajukan pada seminar proposal. 4. Mahasiswa akan memaparkan rencana pelaksanaan Tugas Akhir/Skripsinya pada seminar proposal sesuai dengan jadwal yang ditentukan untuk memberikan penjelasan tentang proposal yang diajukan. 5. Dalam seminar proposal, akan diputuskan:\n\n    * Disetujui atau tidak judul dan isi Tugas Akhir/Skripsi\n\n    * Perlu atau tidak perbaikan proposal dilakukan\n\n5. Jika proposal disetujui dengan melakukan perbaikan, mahasiswa harus melakukan perbaikan yang diminta paling lambat 1 minggu setelah seminar proposal dan menyerahkan perbaikan tersebut kepada masing-masing pembimbing dan pembanding. 6. Jika proposal tidak disetujui, mahasiswa berhak mengajukan proposal baru di periode berikutnya. ## 7. SEMINAR HASIL DAN SIDANG MEJA HIJAU\n\nUntuk dapat melaksanakan Seminar hasil dan sidang meja hijau maka:\n\n9\n\nProgram Studi Ilmu Komputer Fasilkom-TI USU\n\n\n---\n\nLogo Universitas Sumatera Utara\n\n# PEDOMAN TUGAS\n## AKHIR/SKRIPSI\n\n<table>\n    <tr>\n        <th>No. Dokumen</th>\n        <th>:</th>\n    </tr>\n<tr>\n        <td>Edisi</td>\n<td>:</td>\n    </tr>\n<tr>\n        <td>Revisi</td>\n<td>:</td>\n    </tr>\n<tr>\n        <td>Tanggal Terbit</td>\n<td>: 2022</td>\n    </tr>\n<tr>\n        <td>Halaman</td>\n<td>: 10 dari 14</td>\n    </tr>\n</table>\n\n1.', 'Telah menyelesaikan semua persyaratan pemberkasan Seminar. Untuk berkas yang perlu dipersiapkan dapat dilihat pada e-learning Tugas Akhir Ilmu Komputer. 5. Telah mendapat persetujuan tim pembimbing terhadap rancangan Skripsi; dan\n6. Telah mendapatkanpenetapan waktu pelaksanaan oleh Program Studi dan Fakultas.']","Berikut adalah jawaban untuk pertanyaan Anda:

Minimal jumlah peserta dalam satu kali kegiatan seminar dan sidang adalah 1 orang, sedangkan maksimal jumlah peserta adalah 7 orang.

Sumber: [Source 1: Prosedur Tugas Akhir Prodi S-1 Ilmu Komputer.md] - Poin 4.",Minimal 1 orang dan maksimal 7 orang dalam satu kali kegiatan seminar dan sidang.,1.0,0.7936308952549658,0.99999999995,1.0,0.971784089835858
"Jika mahasiswa mengikuti Seminar Proposal pada tanggal 14 April 2026, kapan batas akhir pengumpulan berkasnya?","['8. Jika Berkas skripsi yang diupload tidak valid, maka pendaftaran akan dibatalkan. RENCANA PELAKSAAN SEMINAR MAHASISWA PRODI S1 ILMU KOMPUTER\nJadwal Seminar Semester Genap 2025-2026\n\n<table>\n  <thead>\n    <tr>\n        <th>Tanggal/Hari Seminar</th>\n        <th>Pelaksanaan</th>\n        <th>Batas Akhir Pengumpulan Berkas</th>\n    </tr>\n  </thead>\n  <tbody>\n    <tr>\n        <td>24 Februari 2026 / Selasa</td>\n<td>Semhas</td>\n<td>20 Feb 2026/Pukul 11.00 WIB</td>\n    </tr>\n<tr>\n        <td>10 Maret 2026 / Selasa</td>\n<td>Sempro (Online)</td>\n<td>02 Mar 2026/Pukul 11.00 WIB</td>\n    </tr>\n<tr>\n        <td>17 Maret 2026 / Selasa</td>\n<td>Semhas (online)</td>\n<td>09 Mar 2026/Pukul 11.00 WIB</td>\n    </tr>\n<tr>\n        <td>07 April 2026 / Selasa</td>\n<td>Sidang</td>\n<td>01 April 2026/Pukul 11.00 WIB</td>\n    </tr>\n  </tbody>\n</table>\n\n\n\n---\n\n\n\n<table>\n  <tbody>\n    <tr>\n        <td>14 April 2026/ Selasa</td>\n<td>Sempro</td>\n<td>08 April 2026/Pukul 11.00 WIB</td>\n    </tr>\n<tr>\n        <td>21 April 2026 / Selasa</td>\n<td>Semhas</td>\n<td>15 April 2026/Pukul 11.00 WIB</td>\n    </tr>\n<tr>\n        <td>28 April 2026 / Selasa</td>\n<td>Sidang</td>\n<td>22 April 2026/Pukul 11.00 WIB</td>\n    </tr>\n<tr>\n        <td>05 Mei 2026/ Selasa</td>\n<td>Sempro</td>\n<td>29 April 2026/Pukul 11.00 WIB</td>\n    </tr>\n<tr>\n        <td>12 Mei 2026 / Selasa</td>\n<td>Sidang</td>\n<td>06 Mei 2026/Pukul 11.00 WIB</td>\n    </tr>\n<tr>\n        <td>19 Mei 2026 / Selasa</td>\n<td>Semhas</td>\n<td>13 Mei 2026/Pukul 11.00 WIB', '3. Mahasiswa wajib menyiapkan diri untuk memberikan penjelasan mengenai proposal yang diajukan pada seminar proposal. 4. Mahasiswa akan memaparkan rencana pelaksanaan Tugas Akhir/Skripsinya pada seminar proposal sesuai dengan jadwal yang ditentukan untuk memberikan penjelasan tentang proposal yang diajukan. 5. Dalam seminar proposal, akan diputuskan:\n\n    * Disetujui atau tidak judul dan isi Tugas Akhir/Skripsi\n\n    * Perlu atau tidak perbaikan proposal dilakukan\n\n5. Jika proposal disetujui dengan melakukan perbaikan, mahasiswa harus melakukan perbaikan yang diminta paling lambat 1 minggu setelah seminar proposal dan menyerahkan perbaikan tersebut kepada masing-masing pembimbing dan pembanding. 6. Jika proposal tidak disetujui, mahasiswa berhak mengajukan proposal baru di periode berikutnya. ## 7. SEMINAR HASIL DAN SIDANG MEJA HIJAU\n\nUntuk dapat melaksanakan Seminar hasil dan sidang meja hijau maka:\n\n9\n\nProgram Studi Ilmu Komputer Fasilkom-TI USU\n\n\n---\n\nLogo Universitas Sumatera Utara\n\n# PEDOMAN TUGAS\n## AKHIR/SKRIPSI\n\n<table>\n    <tr>\n        <th>No. Dokumen</th>\n        <th>:</th>\n    </tr>\n<tr>\n        <td>Edisi</td>\n<td>:</td>\n    </tr>\n<tr>\n        <td>Revisi</td>\n<td>:</td>\n    </tr>\n<tr>\n        <td>Tanggal Terbit</td>\n<td>: 2022</td>\n    </tr>\n<tr>\n        <td>Halaman</td>\n<td>: 10 dari 14</td>\n    </tr>\n</table>\n\n1.', '# Prosedur Tugas Akhir Prodi S-1 Ilmu Komputer\n\n*Diperuntukkan Bagi Mahasiswa Program Studi Ilmu Komputer yang sedang mengambil Mata Kuliah Tugas Akhir.*\n\nKepada mahasiswa, mohon dibaca deskripsi dan panduan submisi dengan baik agar tidak terjadi kesalahan. Jadwal Kegiatan Seminar Proposal, Hasil dan Sidang akan diberikan setelah syarat berikut ini terpenuhi :\n\n1. Mulai Semester Genap 2024/2025 Jadwal Tanggal Kegiatan Seminar Proposal, Hasil dan Sidang sesuai dengan jadwal terlampir. 2. Mahasiswa harap memperhatikan dan mengikuti tanggal-tanggal yang tertera pada jadwal. 3.', 'Mahasiswa yang sedang MBKM juga diperbolehkan mengajukan proposal Tugas Akhir dengan pertimbangan tidak mengganggu kegiatan MBKM. ## a. Persyaratan Seminar Proposal\n\nUntuk mengajukan proposal Tugas Akhir/Skripsi mahasiswa harus memenuhi persyaratan sebagai berikut:\n\n1. Proposal penelitian dapat disusun oleh mahasiswa setelah exum di-acc oleh kedua pembimbing.', '## 4. Tahap Pelaksanaan Seminar Proposal\n\n* Penjadwalan: Pihak Prodi / Fakultas melakukan Penjadwalan Seminar Proposal. * Pelaksanaan: Prodi / Fakultas menyelenggarakan agenda Seminar Proposal yang diikuti oleh Mahasiswa. * Pengajuan Ulang (jika ada revisi/proses administratif): Selama proses ini, Mahasiswa juga melakukan Pengajuan Seminar Proposal. * Percabangan (Proposal Diterima?):\n\n3\n\nProgram Studi Ilmu Komputer Fasilkom-TI USU\n\n\n---\n\nUNIVERSITAS UTA U U\n\n# PEDOMAN TUGAS\n## AKHIR/SKRIPSI\n\n**No. Dokumen**:     \n**Edisi**:     \n**Revisi**:     \n**Tanggal Terbit**: 2022\n**Halaman**: 4 dari 14\n\n* o Jika TIDAK: Mahasiswa harus mengulang kembali ke tahap Bimbingan Executive Summary. * o Jika YA: Mahasiswa dapat melangkah ke tahap akhir, yaitu Persiapan Seminar Hasil. Tahapan-tahapan Seminar Hasil dan Sidang Meja Hijau\n\n1. Tahap Bimbingan dan Penulisan Skripsi\n\n* Mulai: Proses diawali oleh Mahasiswa. * Bimbingan Awal: Mahasiswa melakukan Bimbingan Tugas Akhir dengan Dosen Pembimbing 1 dan 2. * Penulisan: Mahasiswa melanjutkan ke tahap Penulisan Skripsi. * Pengujian: Mahasiswa melakukan Uji Program dengan Dosen Pembimbing. 2. Tahap Cek Plagiat dan Validasi Dosen Pembimbing\n\n* Pengajuan: Mahasiswa melakukan Pengajuan Seminar Hasil. * Verifikasi Plagiat: Pihak Prodi / Fakultas melakukan Cek Plagiat. * Percabangan (Similarity $\\le$ 25%?):\n\n  * o Jika TIDAK: Mahasiswa harus kembali ke tahap Penulisan Skripsi. * o Jika YA: Dosen Pembimbing (DOPING) akan memberikan Acc Seminar Hasil. 3', 'Pada masa pandemi Covid 19, kegiatan seminar mahasiswa baik itu seminar proposal, seminar hasil dan sidang sarjana dilakukan secara daring dengan platform e-learning USU. Tahapan pemberkasan dan penilaian juga dilakukan melalui e-learning USU, dan setelah USU Kembali melakukan kegiatan perkuliahan secara tatap muka, pemberkasan seminar tetap dilaksanakan melalui e-lerarning agar lebih terdata. Berdasarkan hal ini maka pada pedoman ini juga menjelaskan tahapan pemberkasan yang harus dilakukan oleh mahasiswa dan juga penjelasan tentang penilaian oleh dosen pembimbing dan penguji. Terdapat 2 tahapan utama pada pelaksanaan Tugas Akhir yaitu dari proses pengajuan judul sampai dengan seminar proposal dan dari seminar hasil sampai ke iding meja hijau. 2\n\nProgram Studi Ilmu Komputer Fasilkom-TI USU\n\n\n---\n\n\n\n<table>\n    <tr>\n        <th>UNIVERSITAS SUMATERA UTARA logo</th>\n        <th>**PEDOMAN TUGAS AKHIR/SKRIPSI**</th>\n        <th>No.', 'Penelitian\n\n9. Exum (Judul, Latar Belakang, Rumusan Masalah, Metodologi, Referensi)\n\n10. Tanda tangan mahasiswa\n\n---\n\n# Seminar Proposal\n\nUntuk maju seminar proposal mahasiswa perlu menyelesaikan dua submission di bawah ini secara berurutan. ## 1. Persetujuan Seminar Proposal\n\nMahasiswa diharuskan mendapatkan persetujuan untuk mengikuti seminar Proposal oleh dosen pembimbing melalui modul ini. Mahasiswa wajib mengirimkan file submission berupa :\n\n1. File Proposal dengan format : PROPOSAL_NIM.pdf\n\n2. File Form Persetujuan Seminar Proposal yang sudah diisi dan ditandatangani oleh Dosen Pembimbing dengan format : DOPING_NIM.pdf beserta dengan lembar kendali bimbingan pra proposal yang telah ditandatangani oleh dosen pembimbing\n\nKedua file tersebut diupload pada 2 file yang berbeda agar dapat dilakukan review oleh pembimbing. ## 2. Workshop Seminar Proposal\n\nModul ini digunakan untuk melakukan penilaian pada saat seminar proposal. Mahasiswa diwajibkan melakukan submission kembali dengan proposal yang sudah siap dengan format : Proposal_NIM.pdf\n\nPhase submission ditutup selama seminar proposal berlangsung dan akan dibuka kembali setelah seminar proposal selesai. # Seminar Hasil\n\nUntuk maju seminar hasil mahasiswa perlu menyelesaikan enam submission di bawah ini secara berurutan.', 'Menulis Proposal Penelitian\n\nMahasiswa yang akan menyelesaikan studinya di tingkat sarjana (S1) diwajibkan untuk menuliskan hasil penelitiannya berupa skripsi. Penulisan skripsi tersebut akan dimulai dengan mengajukan proposal penelitian, sebagai kerja awal untuk mengadakan penelitian ilmiah. Proposal penelitian adalah sebuah konsep sementara yang masih harus dikaji dan disempurnakan lebih lanjut melalui seminar proposal. Dalam seminar proposal mahasiswa akan mendapatkan saran-saran perubahan dan penyempurnaan dari peserta seminar untuk menetapkan kelayakan proposal yang diajukan. Apabila proposal yang diajukan disetujui untuk dilanjutkan, mahasiswa kemudian dapat melanjutkan penelitiannya dan dapat berkonsultasi dengan komisi pembimbing yang ditetapkan oleh program studi. Proposal penelitian secara garis besar memuat bagian-bagian sebagai berikut:\n\n1.', 'Urutan Peserta yang dinyatakan terdaftar mengikuti waktu submisi kegiatan Seminar / Sidang ( *First Come First Serve* )\n\n7. Jika kuota pendaftaran belum terpenuhi, maka jadwal tidak akan dibuat.', 'Mahasiswa wajib melakukan bimbingan Tugas Akhir/Skripsi sesuai dengan arahan Pembimbing 1 dan/atau Pembimbing 2. Jadwal dan materi konsultasi dicatat dalam Log Book yang disediakan mahasiswa pada saat bimbingan. 3. Bila dalam 1 semester Tugas Akhir/Skripsi tidak selesai dikerjakan, mahasiswa dapat mengajukan permohonan perpanjangan waktu pengerjaan Tugas Akhir/Skripsi maksimal 6 bulan, dan harus memberikan penjelasan dalam sidang pertanggungjawaban Tugas Akhir/Skripsi. 4.']","Based on the provided information, I found the relevant table for the Seminar Proposal on April 14, 2026.

| Tanggal/Hari Seminar | Pelaksanaan | Batas Akhir Pengumpulan Berkas |
| --- | --- | --- |
| 14 April 2026/ Selasa | Sempro | 08 April 2026/Pukul 11.00 WIB |

Therefore, the answer to the question is:

The batas akhir pengumpulan berkas untuk Seminar Proposal pada tanggal 14 April 2026 adalah 08 April 2026, pukul 11.00 WIB.","Jika seminar proposal dilaksanakan 14 April 2026, batas akhir pengumpulan berkas adalah 08 April 2026, pukul 11.00 WIB.",0.5,0.8469074012539898,0.5916666666469445,1.0,0.5110680125443732
